{
  "type": "object",
  "properties": {
    "schema_version": {
      "const": 1
    },
    "id": {
      "type": "string",
      "minLength": 1
    },
    "applicability": {
      "type": "object",
      "properties": {
        "controller": {
          "type": "string",
          "minLength": 1
        },
        "revision": {
          "type": "string",
          "minLength": 1
        },
        "firmware": {
          "type": "string",
          "minLength": 1
        },
        "transport": {
          "type": "string",
          "minLength": 1
        },
        "scope": {
          "type": "string",
          "minLength": 1
        }
      },
      "required": [
        "controller",
        "revision",
        "firmware",
        "transport",
        "scope"
      ],
      "additionalProperties": false
    },
    "claim": {
      "type": "string",
      "minLength": 1
    },
    "direction": {
      "enum": [
        "input",
        "output",
        "feature"
      ]
    },
    "logical_id": {
      "type": "integer",
      "minimum": 0,
      "maximum": 255
    },
    "raw_includes_id": {
      "type": "boolean"
    },
    "length": {
      "type": "integer",
      "minimum": 0
    },
    "offset_origin": {
      "type": "string",
      "minLength": 1
    },
    "bit_numbering": {
      "type": "string",
      "minLength": 1
    },
    "endian": {
      "type": "string",
      "minLength": 1
    },
    "signedness": {
      "type": "string",
      "minLength": 1
    },
    "units": {
      "type": "string",
      "minLength": 1
    },
    "coordinate_frame": {
      "type": "string",
      "minLength": 1
    },
    "values": {
      "type": "string",
      "minLength": 1
    }
  },
  "required": [
    "schema_version",
    "id",
    "applicability",
    "claim",
    "direction",
    "logical_id",
    "raw_includes_id",
    "length",
    "offset_origin",
    "bit_numbering",
    "endian",
    "signedness",
    "units",
    "coordinate_frame",
    "values"
  ],
  "additionalProperties": false,
  "$schema": "https://json-schema.org/draft/2020-12/schema"
}
