{
  "schema_version": 1,
  "id": "ds-firmware-shape",
  "applicability": {
    "controller": "dualsense",
    "revision": "unknown",
    "firmware": "unknown",
    "transport": "usb",
    "scope": "Linux v6.12 host contract"
  },
  "claim": "ds-firmware",
  "direction": "feature",
  "logical_id": 32,
  "raw_includes_id": true,
  "length": 64,
  "offset_origin": "report ID at byte zero",
  "bit_numbering": "lsb0",
  "endian": "little",
  "signedness": "field-dependent; unknown unless separately specified",
  "units": "unknown",
  "coordinate_frame": "unknown",
  "values": "unknown"
}
